{
  "board_id": "project:42",
  "name": "Finance SSC Month-End",
  "owner": {
    "partner_id": 1201,
    "email": "maria.santos@company.com",
    "name": "Maria Santos"
  },
  "visibility": "team",
  "members": [
    {
      "partner_id": 1201,
      "email": "maria.santos@company.com",
      "name": "Maria Santos",
      "role": "manager"
    }
  ],
  "stages": [
    {
      "stage_id": "stage:10",
      "name": "Backlog",
      "order": 10,
      "wip_limit": null
    }
  ],
  "tags": [
    {
      "tag_id": "tag:1",
      "name": "VAT",
      "color": "#3b82f6"
    }
  ],
  "description": "Month-end closing tasks",
  "created_at": "2025-12-01T08:00:00+08:00",
  "updated_at": "2025-12-15T14:30:00+08:00"
}
